{
  "$schema": "https://json-schema.org/draft/2020-12/schema",
  "title": "dispatch.json — playbook schema 1.0",
  "type": "array",
  "minItems": 0,
  "items": {
    "type": "object",
    "properties": {
      "schema_version": {
        "const": "1.0"
      },
      "cell_id": {
        "type": "string",
        "pattern": "^-?\\d+\\.\\d{2}_-?\\d+\\.\\d{2}$"
      },
      "ts": {
        "type": "string",
        "format": "date-time",
        "pattern": "^\\d{4}-\\d{2}-\\d{2}T\\d{2}:\\d{2}:\\d{2}(?:\\.\\d+)?Z$"
      },
      "dispatch_id": {
        "type": "string",
        "minLength": 1
      },
      "action": {
        "enum": [
          "DISPATCH",
          "SMS_WARN",
          "REWET",
          "MONITOR",
          "BRIEF"
        ]
      },
      "priority": {
        "type": "integer",
        "minimum": 1,
        "maximum": 4
      },
      "target": {
        "type": "object",
        "properties": {
          "lat": {
            "type": "number",
            "minimum": -90,
            "maximum": 90,
            "not": {
              "enum": [
                -999
              ]
            }
          },
          "lon": {
            "type": "number",
            "minimum": -180,
            "maximum": 180,
            "not": {
              "enum": [
                -999
              ]
            }
          }
        },
        "required": [
          "lat",
          "lon"
        ],
        "additionalProperties": false
      },
      "audiences": {
        "type": "array",
        "minItems": 1,
        "uniqueItems": true,
        "items": {
          "enum": [
            "manggala_agni",
            "mpa",
            "bpbd",
            "brgm",
            "leadership"
          ]
        }
      },
      "messages": {
        "type": "object",
        "propertyNames": {
          "enum": [
            "manggala_agni",
            "mpa",
            "bpbd",
            "brgm",
            "leadership"
          ]
        },
        "additionalProperties": {
          "type": "object",
          "properties": {
            "id": {
              "type": "string",
              "minLength": 1
            },
            "en": {
              "type": "string",
              "minLength": 1
            }
          },
          "required": [
            "id",
            "en"
          ],
          "additionalProperties": false
        }
      },
      "water_source": {
        "anyOf": [
          {
            "type": "null"
          },
          {
            "type": "object",
            "properties": {
              "lat": {
                "type": "number",
                "minimum": -90,
                "maximum": 90,
                "not": {
                  "enum": [
                    -999
                  ]
                }
              },
              "lon": {
                "type": "number",
                "minimum": -180,
                "maximum": 180,
                "not": {
                  "enum": [
                    -999
                  ]
                }
              },
              "distance_km": {
                "type": "number",
                "minimum": 0,
                "not": {
                  "enum": [
                    -999
                  ]
                }
              },
              "kind": {
                "type": "string",
                "minLength": 1
              }
            },
            "required": [
              "lat",
              "lon",
              "distance_km",
              "kind"
            ],
            "additionalProperties": false
          }
        ]
      },
      "rationale": {
        "type": "string",
        "minLength": 1
      },
      "status": {
        "type": "string",
        "minLength": 1
      }
    },
    "required": [
      "schema_version",
      "cell_id",
      "ts",
      "dispatch_id",
      "action",
      "priority",
      "target",
      "audiences",
      "messages",
      "water_source",
      "rationale",
      "status"
    ],
    "additionalProperties": false
  }
}
