[
  {
    "schema_version": "1.0",
    "dispatch_id": "d_20261017_0001",
    "cell_id": "-2.35_114.05",
    "ts": "2026-10-17T09:05:00Z",
    "action": "DISPATCH",
    "priority": 1,
    "target": {
      "lat": -2.35,
      "lon": 114.05
    },
    "audiences": [
      "manggala_agni",
      "mpa",
      "bpbd",
      "brgm",
      "leadership"
    ],
    "messages": {
      "manggala_agni": {
        "id": "Simulasi: siapkan patroli ke -2.35, 114.05; risiko 0.91 dalam 72 jam; sumber air terdekat: canal di -2.33, 114.02 (4.007 km).",
        "en": "Simulation: prepare a patrol to -2.35, 114.05; risk 0.91 over 72 hours; nearest water source: canal at -2.33, 114.02 (4.007 km)."
      },
      "mpa": {
        "id": "Simulasi: warga di sekitar -2.35, 114.05 diminta waspada dan tidak membakar lahan.",
        "en": "Simulation: communities near -2.35, 114.05 should remain alert and avoid land burning."
      },
      "bpbd": {
        "id": "Simulasi: koordinasikan kesiapsiagaan pada -2.35, 114.05; sumber air terdekat: canal di -2.33, 114.02 (4.007 km).",
        "en": "Simulation: coordinate readiness at -2.35, 114.05; nearest water source: canal at -2.33, 114.02 (4.007 km)."
      },
      "brgm": {
        "id": "Simulasi: tinjau kebutuhan pembasahan pada -2.35, 114.05; kelembapan gambut dalam 0.14 m³/m³.",
        "en": "Simulation: assess rewetting needs at -2.35, 114.05; deep soil moisture is 0.14 m³/m³."
      },
      "leadership": {
        "id": "Simulasi: 1 sel kritis (horizon 72 jam); 22 hari tanpa hujan ≥1 mm.",
        "en": "Simulation: 1 critical cell(s) at the 72-hour horizon; 22 day(s) without ≥1 mm rain."
      }
    },
    "water_source": {
      "lat": -2.33,
      "lon": 114.02,
      "distance_km": 4.007,
      "kind": "canal"
    },
    "rationale": "Risk 0.91 for 72h on -2.35_114.05; 22 days since rain; deep soil moisture 0.14 (Δ7d -0.06). Top factors: days_since_rain=0.34, sm_27_81_delta_7d=0.24, vpd_mean_24h=0.19. Sumber air terdekat: canal di -2.33, 114.02 (4.007 km). Simulated alert only.",
    "status": "PENDING"
  }
]
